*Paradigms Week 1-2 4	klele di skul peindu, klele ne skul peindu, klele no skul pei mendu, klele ige kalil skil pei mendu, klele igoro skul pei mendu, klele ingge skul peinda, klele inggoro skul peindo, klele naga skul peinda	a long time ago, X went to school
*Paradigms Week 1-2 5	sale di skul peisa, sale ne skul peisu, sale no skul peina, sale ige skul peisugo, sale igoro skul peisu, sale ingge skul peisa, sale inggoro skul peisu, sale naga skul peisa	yesterday X went to school
*Paradigms Week 1-2 6	di kil peipsan, ne kil peie, no kil peina, ige kil peip, igoro kil peip, ingge kil peingge, inggoro kil peip, naga kil peisa	now, X is going to the water
*Paradigms Week 1-2 7	abnan di kil peisa, abnan ne kil pei, abnan no kil peisunu, abnan ige kil peingsunu, abnan igoro kil peingsunu, abnan ingge kil peingg, abnan inggoro kil peingg, abnan naga kil peingg	tomorrow, X will go to the water
*Paradigms Week 1-2 29	ige kalil peie bo ningsunu	let's go kill a pig!
*Paradigms Week 1-2 39	di mandanga peisan; ne mandanga peinggu; no mandanga peisunu; ige mandanga peingsunu; ingge mandanga peingsan; naga mandanga peingsan	X will go to town
Old Man Banana 5	ki yaba halu peimblu	he was following the water
Old Man Banana 8	masu pu peimblu	he was fishing
Old Man Banana 10	masu ni peimblu	he killed a fish and kept going
Old Man Banana 11	peina ki kindili barana	he went and went and came to the head of the river
Old Man Banana 18	no tambe pei peindu ali pi	he chased the possum into a hole in the tree
Old Man Banana 19	no peimblu	he went on
Old Man Banana 31	peindu ba:bundu	he went on up
Old Man Banana 34	bia urail peindu ba:bundu janggae nomu urail peindu bago	the woman went up this way and the man went up
Old Man Banana 35	nasago no bia peindu wulangdu "eh, di ne unuk nasa goe"	he looked at her and asked "hey, didn't I see you down there?"
Old Man Banana 42	no peindu ba:bundu	he went on up
Old Man Banana 43	nomu go ser peindu jaia pe 	the man went and he turned into a wild banana tree
Old Man Banana 46	no peindu ba:bundu ba baaa nomu nabu	she went up and up and didn't see the man
Old Man Banana 47	peindu ki kindili bara gogogndu	she went up to the head of the water and looked around
Old Man Banana 54	no kabil peimblu bia go no kabil peindu	he went home and the woman went home
Old Man Banana 71	towo go no peindu no sina bele ngonggli pumblu	the big man was sleeping and snoring
Old Man Banana 74	iamba peinda nomu towo go nanda, oh nomu towo hama tende	he looked and looked and found the old man, the old man ?? ??
Housework 15	kulgul peimu	we go to the garden
Housework 18	di peisa paia iambama	I go get food from the garden
Housework 50	naga paia skul peima	they eat and go to school
Housework 52	di mi nomu yogoro peimu kulgul peimu	my husband and I go to the garden
Housework 53	peisa	we go
Housework 85	di papa na peie di papa peie nggalu mende di kabil me kabil kirigma	my husband goes to work and I stay at home and sweep
Housework 86	kabi kirige pubu kidigie yable pubu peisa kil peie kidigie	when the sweeping is done I take the dishes and go down to the water and wash them
Housework 90	skul peisa ka pa ia	they go to school and come home and eat
Boy And Spirit 9	peina mi jibimblu	he went to weed/tend to the bananas
Boy And Spirit 21	peimblu	he went
Boy And Spirit 22	andon peimblu	he went at night
Boy And Spirit 26	mi peina haina	the bananas got ripe
Boy And Spirit 31	mi peina buna	he went up the banana tree
Boy And Spirit 32	no peina bunaaa mange mi iamblu	he went up and sat and ate bananas
Boy And Spirit 46	peina buna kere iba	he couldn't go up
Boy And Spirit 50	peina buna kere iba	he (the spirit) couldnt' get up
Boy And Spirit 55	yobu hamban peina mi gendlegna	with one hand, I can't climb up the banana tree
Boy And Spirit 62	mandage peina mi punue gendlegna iba	just a torso can't climb a banana tree!
Gesigo 6	no peina buna bambi yobrum pu peina	he (the spirit) took his two children and went
Gesigo 7	bo, añe, ionggo, bome, pubu kalil handugu giring gorong peimblu	pig, dog, big leaves, sago, (the spirit) filled (his bag with) them and they made noise (as he went)
Gesigo 8	peimblu	ol go nau
Gesigo 9	peimblu... peina nuka si nana	He was going to look for a friend of his
Gesigo 10	nuka peina nana	he found his friend
Gesigo 12	nuka nu le lu no peimblu	em  kam abrusim em em i go
Gesigo 13	yagunu tenem peimblu	he (masalai) went off, singing
Gesigo 14	peimblu	he went
Gesigo 15	peindu eee bo	he went, (singing) heeeey, pig!
Gesigo 16	peie handi pubo kalil gunggreng gunggreng peina	pulapim olgeta samting na nois wantaim na i go
Gesigo 21	bambi yobrum bago peina	em singautim tupla pikinini na i go
Gesigo 24	tf peime nu peindu banis gerendu	em i go wokim banis na putim pik
Gesigo 28	bo lena bambi yobrum pu peina	he left the pigs, got the two children, and went
Gesigo 29	peimblu pubu kalil de nganu punu peimblu	em korosim ol na em i go
Gesigo 30	peina peina peinaaaa gol barana	he went and went and went up on a mountain
In The Bush 3	hede man nomu yobrum bam naga tamal ili peinda	the story of three men who went into the bush
In The Bush 25	peinda tamal ili peinda	they went into the bush
In The Bush 26	pei peie tama gamsigele	into the center of the big bush
In The Bush 39	ali wengg bububue peindu angglel bigik barae	he went up the tree, up up up to the top
In The Bush 51	James tilenda hiou si go peindu pue kandu ige handil handugundu bale	James went and got the possum and we put it in a bilum
In The Bush 60	ki wula towo ba: bundu pei pei ambu peindu barandu	they came to a little stream, followed it, go, go, and came to Ambu
In The Bush 62	peindu barandu	went and came up
In The Bush 64	peie lamu dzundu	went and made a fire
In The Bush 111	naga peinda kabil dzigi peinda	they hid it in the house
In The Bush 114	pa iap te ige peinde bambi kabil peie hiou si go pue pam pagi iandu	when we eat we go to the house of the boys and eat our food with some possum
Buai Story 11	no handu peie naga mia lu sibie naga peima	when they went near him, they would spit on him and go away
Buai Story 15	nomu bubele naga yagono peinde manda go peinde	the good men went to the good place
Buai Story 17	nagoro (se) naga peinda nomu temi lenda	they went singsing, the gross man was left behind
Buai Story 20	naga peinda yagono ugi ndago	then they went to singsing
Buai Story 21	yagono ya- yagono peinda kasang	they went (and got) bilas(ed up) for singsing
Buai Story 23	kasanggna kasang imba naga peie tile yagono ugindna	bilas pinis, they got up and went singsing 
Buai Story 29	di peimago naga yagono ugi sago di peimago	I'm going- they're singsinging and I'm going
Buai Story 30	de no peindu	and so he went
Buai Story 31	peindu baranda naga yagono statim	They arrived and started singsing (ol go kamap statim singsing)
Buai Story 34	no peindu bara tilendu	he came and stood up
Buai Story 36	nomu temi hogo peindu tilendu	The gross man went and stood up
Buai Story 44	naga yagono po peinda	(ol kisim singsing go) they started singing
Buai Story 45	peinda naga yagono uginda	they went and sang (ol i go ol singsing)
Buai Story 48	yagono honggalo honggalo peindu semblandu	they kept singing as the sun rose
Buai Story 49	semblandu no peindu tf	at daybreak, he went
Buai Story 50	wanem samblandu no peindu	at daybreak, he went
Buai Story 52	peindu 5 eh or 6 oclock	he left at 5 or 6 oclock
Buai Story 54	wula go yagono le no peindu	the boy left the singsing and went
Buai Story 58	semblen santesa se hurandu no peindu gendi tile mendu	still dawn, he went and stood to the side of the road
Buai Story 61	wula go iamba ibande wula go peindu bab tile mendu	mangi i painim nogat i go sanap antap stap (they looked for the boy and he was standing up over there)
Buai Story 64	arait, naga jagi yagono pu peinda yagono urinda	ol yet, ol i go pinisim singsing
Buai Story 81	nagoro peindesu subu tasan de iarandu naga bia yobrum peindago tf	the boy tricked them, saying "you go ahead, I'm going to go poop first" (and they went?)
Buai Story 83	no peinda no nga dienda naga d- digeren no nga dienda	they had an idea to trick the boy's mother
Buai Story 95	pue peinda sengsel tilenda no nga lapun gogu mendu	they took it and went to stand over by the place. the old mother stayed and looked on ( ??????)
Buai Story 96	ko tf pu peinda tf kininda aiii	they took the bamboo and stood at the place
Buai Story 125	peindu pundu	he sang
Buai Story 135	no peindu handi gambo angdu	she opened the mouth of the bag
Buai Story 137	dugo ge mugo peindu na	it bent this way
Buai Story 138	no nga gurue peinda hogol was	his mom went and stood and watched
Buai Story 143	urail pile unu jangga peindu	he swung back to the other side
Buai Story 144	no nga gurue peindu hogol wasindu	his mother went (to the other side) and watched
Buai Story 146	danggas langga peie ke dondu	he went to the other side and the buai broke
Buai Story 147	oi, ke peina	oi, the buai went (broke)
Buai Story 149	hogol ke peindu hogol purue jarundu	the tree broke and buai spread everywhere
Buai Story 150	hogo manda, raikos jangga ke magi jaru peindu	the buai broke and went out to the Rai Coast
Buai Story 152	peindu nogat... ege manda hane ma pusul ma	The buai went to our homeland and we stayed there
Buai Story 157	ngu nu ke do peindu ige mu	he broke the buai here and we are here
The Evil Stone 14	naga dulu peie	they went fighting
The Evil Stone 17	peie kaba- kabi halul wa menda	they went inside their houses and stayed
The Evil Stone 20	naga peie hogol	they went there
